{
  "contract_version": "astrology_claims_v1",
  "object_id": "astro.aspect.opposition",
  "calc_entity": "astrology.aspect.opposition",
  "pending_source_ids": [
    "src.classical.valens_anthologies",
    "src.traditional.skyscript",
    "src.traditional.houlding_aspects",
    "src.professional.tierney_aspect_analysis"
  ],
  "gap_notes": [
    "CORE cannot be scored for aspect *meaning*. Geometry of 0/60/90/120/180 is now compared (Ptolemy I.16/I.27 + Lilly CA I.1). Qualitative labels are not the same system: Ptolemy harmonious/discordant-by-sex vs Lilly good/enmity/concord. Do not collapse.",
    "Lilly CA I.1 opened. CA ~p.105 terms/aspects table still unopened; not backfilled.",
    "Lilly: sextile indifferent good; square enmity and not good; trine unity/concord/friendship; opposition a bad aspect; conjunction good or ill according to the question. None of these attest requires_action.",
    "requires_action is boolean in schema (no unknown/not_evidenced). false here means the opened locus does not establish the property — not the assertion 'this aspect does not require action'. Schema not expanded."
  ],
  "claims": [
    {
      "concept_id": "claim.aspect.opposition.discordant",
      "source_id": "src.classical.ptolemy_tetrabiblos",
      "source_class": "classical",
      "author": "Claudius Ptolemy / J.M. Ashmand trans.",
      "edition": "Ashmand 1822; Gutenberg ebook 70850",
      "school": "hellenistic",
      "reviewer": null,
      "reviewed_at": null,
      "locus": "Tetrabiblos Book I Chapter XVI (Ashmand p.24–26)",
      "original_claim": "Diametrical distance of a hundred and eighty degrees is a configuration. Opposition and quartile are discordant, between signs of different sexes.",
      "normalized_claim": "Opposition is a 180-degree configuration classed discordant",
      "evidence_tier": "school_specific",
      "review_status": "extracted",
      "field": "interaction"
    },
    {
      "concept_id": "claim.aspect.opposition.angle",
      "source_id": "src.classical.ptolemy_tetrabiblos",
      "source_class": "classical",
      "author": "Claudius Ptolemy / J.M. Ashmand trans.",
      "edition": "Ashmand 1822; Gutenberg ebook 70850",
      "school": "hellenistic",
      "reviewer": null,
      "reviewed_at": null,
      "locus": "Tetrabiblos Book I Chapter XVI (Ashmand p.24–26)",
      "original_claim": "Diametrical distance of a hundred and eighty degrees is a configuration. Opposition and quartile are discordant, between signs of different sexes.",
      "normalized_claim": "opposition is 180 degrees",
      "evidence_tier": "supported",
      "review_status": "compared",
      "field": "angle"
    },
    {
      "concept_id": "claim.aspect.opposition.angle",
      "source_id": "src.classical.lilly_christian_astrology",
      "source_class": "classical",
      "author": "William Lilly",
      "edition": "Christian Astrology 1659; Wikisource p.25–26",
      "school": "traditional_horary",
      "reviewer": null,
      "reviewed_at": null,
      "locus": "Book I Chapter I Aspects (1659 p.25–26)",
      "original_claim": "When two Planets are 180 degrees distant, that Aspect is Opposition.",
      "normalized_claim": "Opposition is 180 degrees",
      "evidence_tier": "supported",
      "review_status": "compared",
      "field": "angle"
    },
    {
      "concept_id": "claim.aspect.opposition.lilly_quality",
      "source_id": "src.classical.lilly_christian_astrology",
      "source_class": "classical",
      "author": "William Lilly",
      "edition": "Christian Astrology 1659; Wikisource p.25–26",
      "school": "traditional_horary",
      "reviewer": null,
      "reviewed_at": null,
      "locus": "Book I Chapter I Aspects (1659 p.25–26)",
      "original_claim": "Opposition is a bad Aspect.",
      "normalized_claim": "Lilly classes opposition as a bad aspect",
      "evidence_tier": "school_specific",
      "review_status": "extracted",
      "field": "interaction"
    }
  ]
}
