{
  "contract_version": "astrology_claims_v1",
  "object_id": "astro.sign.leo",
  "calc_entity": "astrology.sign.leo",
  "pending_source_ids": [
    "src.classical.valens_anthologies",
    "src.traditional.skyscript",
    "src.psychological.arroyo_four_elements",
    "src.psychological.rudhyar_personality"
  ],
  "gap_notes": [
    "No Layer 2 object yet (1.3.67): later-interpretive slots are optional on IL-1 draft type=sign. Lilly CA I.16 QUALITY still does not fill motivation / strengths / excess / deficiency / behavioral_tendencies without invention. Classification-only drafts wait for a named pass.",
    "Element and mode remain two-system: this Lilly QUALITY line is not Ptolemy winds / tropical-vs-equinoctial. Do not collapse into one taxonomy.",
    "Diseases, places, kingdoms, corporature from the same chapter are horary accidentalia — not copied into a sign knowledge object.",
    "Rulership/exaltation identity stays in Foundation §2.5 — not duplicated here as meaning.",
    "CORE cannot be scored."
  ],
  "claims": [
    {
      "concept_id": "claim.sign.leo.lilly_quality",
      "source_id": "src.classical.lilly_christian_astrology",
      "source_class": "classical",
      "author": "William Lilly",
      "edition": "Christian Astrology 1659; Wikisource p.93–98",
      "school": "traditional_horary",
      "reviewer": null,
      "reviewed_at": null,
      "locus": "Book I Chapter XVI Nature of the twelve signs (1659 p.93–98)",
      "original_claim": "Leo is fiery, hot, dry, choleric, diurnal, commanding, bestial, barren, masculine, of the east and fiery triplicity.",
      "normalized_claim": "Lilly's Leo is fiery, choleric, commanding, bestial, barren",
      "evidence_tier": "school_specific",
      "review_status": "extracted",
      "field": "expression"
    }
  ]
}
