{
  "contract_version": "astrology_claims_v1",
  "object_id": "astro.house.03",
  "calc_entity": "astrology.house.03",
  "pending_source_ids": [
    "src.traditional.skyscript",
    "src.traditional.houlding_houses",
    "src.psychological.sasportas_twelve_houses",
    "src.psychological.george_ancient_practice"
  ],
  "gap_notes": [
    "CORE cannot be scored: topical houses now Lilly CA I.7 + Valens IX. Still classical only. Ptolemy I.13 is not a 12-house list.",
    "Ptolemy Tetrabiblos I.13 gives four-angle temperament (east dry, south hot, west moist, north cold), not 12 topical houses. Lilly ascribes this house list to 'Ptolomeian Doctrine' (CA I.7 close). A source citing Ptolemy is not Ptolemy+Lilly consensus. Attribution unverified from the opened Tetrabiblos locus. Do not mark compared.",
    "No ASC/MC Layer-1 identity objects: I.13 is directional temperament, not persona/status packages.",
    "Layer 3 required slots filled only with Lilly's topical lists. Do not add modern 'psychological houses' (self-actualization, etc.).",
    "Valens IX also gives derived-place meanings (this place relative to III/IV/VII). Schema has no derived-place slot; not copied into domain."
  ],
  "claims": [
    {
      "concept_id": "claim.house.03.domain",
      "source_id": "src.classical.lilly_christian_astrology",
      "source_class": "classical",
      "author": "William Lilly",
      "edition": "Christian Astrology 1659; Wikisource djvu p.77",
      "school": "traditional_horary",
      "reviewer": null,
      "reviewed_at": null,
      "locus": "Book I Chapter VII Third House (1659 p.52)",
      "original_claim": "Signification of brethren, sisters, cousins, kindred, neighbours, small inland journeys, epistles, letters, rumours, messengers.",
      "normalized_claim": "kindred, neighbours, short travel, and messages",
      "evidence_tier": "school_specific",
      "review_status": "extracted",
      "field": "domain"
    },
    {
      "concept_id": "claim.house.03.people",
      "source_id": "src.classical.lilly_christian_astrology",
      "source_class": "classical",
      "author": "William Lilly",
      "edition": "Christian Astrology 1659; Wikisource djvu p.77",
      "school": "traditional_horary",
      "reviewer": null,
      "reviewed_at": null,
      "locus": "Book I Chapter VII Third House (1659 p.52)",
      "original_claim": "Kindred, neighbours, messengers.",
      "normalized_claim": "brothers and sisters; cousins and kindred",
      "evidence_tier": "school_specific",
      "review_status": "extracted",
      "field": "people"
    },
    {
      "concept_id": "claim.house.03.risks",
      "source_id": "src.classical.lilly_christian_astrology",
      "source_class": "classical",
      "author": "William Lilly",
      "edition": "Christian Astrology 1659; Wikisource djvu p.77",
      "school": "traditional_horary",
      "reviewer": null,
      "reviewed_at": null,
      "locus": "Book I Chapter VII Third House (1659 p.52)",
      "original_claim": "Moon here, especially in a moveable sign, argues much travel and being seldom quiet.",
      "normalized_claim": "seldom quiet when the Moon is here in a moveable sign",
      "evidence_tier": "school_specific",
      "review_status": "extracted",
      "field": "risks"
    },
    {
      "concept_id": "claim.house.03.place",
      "source_id": "src.classical.lilly_christian_astrology",
      "source_class": "classical",
      "author": "William Lilly",
      "edition": "Christian Astrology 1659; Wikisource djvu p.77",
      "school": "traditional_horary",
      "reviewer": null,
      "reviewed_at": null,
      "locus": "Book I Chapter VII Third House (1659 p.52)",
      "original_claim": "It is a cadent masculine house and the joy of the Moon.",
      "normalized_claim": "It is a cadent masculine house and the joy of the Moon.",
      "evidence_tier": "school_specific",
      "review_status": "extracted",
      "field": "internal_meaning"
    },
    {
      "source_id": "src.classical.lilly_christian_astrology",
      "source_class": "classical",
      "author": "William Lilly",
      "edition": "Christian Astrology 1659; Wikisource djvu / Book I.7",
      "school": "traditional_horary",
      "reviewer": null,
      "reviewed_at": null,
      "concept_id": "claim.house.03.brothers",
      "locus": "Book I Chapter VII Third House (1659 p.52)",
      "original_claim": "Signification of brethren, sisters, cousins, kindred, neighbours, small inland journeys, epistles, letters, rumours, messengers.",
      "normalized_claim": "the third place concerns brothers",
      "evidence_tier": "supported",
      "review_status": "compared",
      "field": "domain"
    },
    {
      "source_id": "src.classical.valens_anthologies",
      "source_class": "classical",
      "author": "Vettius Valens / Mark Riley trans.",
      "edition": "Riley unperfected English; Kroll 1908 / Pingree 1986 Greek",
      "school": "hellenistic",
      "reviewer": null,
      "reviewed_at": null,
      "concept_id": "claim.house.03.brothers",
      "locus": "Anthologies Book IX The XII Places (Riley 2K;3P)",
      "original_claim": "Place III: concerning the life of brothers. It is also the Place of the Goddess and the Queen.",
      "normalized_claim": "the third place concerns brothers",
      "evidence_tier": "supported",
      "review_status": "compared",
      "field": "domain"
    },
    {
      "source_id": "src.classical.valens_anthologies",
      "source_class": "classical",
      "author": "Vettius Valens / Mark Riley trans.",
      "edition": "Riley unperfected English; Kroll 1908 / Pingree 1986 Greek",
      "school": "hellenistic",
      "reviewer": null,
      "reviewed_at": null,
      "concept_id": "claim.house.03.valens_goddess",
      "locus": "Anthologies Book IX The XII Places (Riley 2K;3P)",
      "original_claim": "Place III is also the Place of the Goddess and the Queen.",
      "normalized_claim": "Valens' third place is also Goddess/Queen; Lilly's short-travel/messages not attested here",
      "evidence_tier": "school_specific",
      "review_status": "extracted",
      "field": "internal_meaning"
    }
  ]
}
