{
  "contract_version": "astrology_claims_v1",
  "object_id": "astro.sign.aries",
  "calc_entity": "astrology.sign.aries",
  "pending_source_ids": [
    "src.traditional.skyscript",
    "src.psychological.arroyo_four_elements",
    "src.psychological.rudhyar_personality"
  ],
  "gap_notes": [
                "1.3.68 classification-only draft: Lilly CA I.16 mode/element/orientation as school_specific object values. Later-interpretive slots remain optional on IL-1 draft type=sign and are omitted. QUALITY adjectives (choleric, deceitful, idle) not copied into object slots. Collisions stay in claims — do not CORE.",
    "Element and mode remain two-system: this Lilly QUALITY line is not Ptolemy winds / tropical-vs-equinoctial. Do not collapse into one taxonomy.",
    "Diseases, places, kingdoms, corporature from the same chapter are horary accidentalia — not copied into a sign knowledge object.",
    "Rulership/exaltation identity stays in Foundation §2.5 — not duplicated here as meaning.",
    "CORE cannot be scored.",
    "Valens I.2 opened: Aries fiery AND watery (weather). Object.element is Lilly fire (1.3.68). Do not compare Valens weather with Lilly fire."
  ],
  "claims": [
    {
      "concept_id": "claim.sign.aries.lilly_quality",
      "source_id": "src.classical.lilly_christian_astrology",
      "source_class": "classical",
      "author": "William Lilly",
      "edition": "Christian Astrology 1659; Wikisource p.93–98",
      "school": "traditional_horary",
      "reviewer": null,
      "reviewed_at": null,
      "locus": "Book I Chapter XVI Nature of the twelve signs (1659 p.93–98)",
      "original_claim": "Aries is masculine, diurnal, moveable, cardinal and equinoctial; fiery, hot and dry, choleric; bestial, luxurious, intemperate and violent.",
      "normalized_claim": "Lilly's Aries is fiery, cardinal, equinoctial, choleric and intemperate",
      "evidence_tier": "school_specific",
      "review_status": "extracted",
      "field": "expression"
    },
    {
      "source_id": "src.classical.valens_anthologies",
      "source_class": "classical",
      "author": "Vettius Valens / Mark Riley trans.",
      "edition": "Riley unperfected English; Kroll 1908 / Pingree 1986 Greek",
      "school": "hellenistic",
      "reviewer": null,
      "reviewed_at": null,
      "concept_id": "claim.sign.aries.valens_fiery",
      "locus": "Anthologies Book I ch.2 Nature of the Twelve Zodiacal Signs (Aries)",
      "original_claim": "Aries is listed as fiery, and also said to be by nature watery, with thunder and hail.",
      "normalized_claim": "Valens' Aries is both fiery as a sign label and watery as weather",
      "evidence_tier": "school_specific",
      "review_status": "extracted",
      "field": "element"
    }
  ]
}
