{
  "contract_version": "astrology_claims_v1",
  "object_id": "astro.aspect.trine",
  "calc_entity": "astrology.aspect.trine",
  "pending_source_ids": [
    "src.classical.valens_anthologies",
    "src.traditional.skyscript",
    "src.traditional.houlding_aspects",
    "src.professional.tierney_aspect_analysis"
  ],
  "gap_notes": [
    "CORE cannot be scored for aspect *meaning*. Geometry of 0/60/90/120/180 is now compared (Ptolemy I.16/I.27 + Lilly CA I.1). Qualitative labels are not the same system: Ptolemy harmonious/discordant-by-sex vs Lilly good/enmity/concord. Do not collapse.",
    "Lilly CA I.19 opened (printed ~p.105): orbs are planetary moieties, two tables, used from memory. Not aspect-orbs and not an IL object field. Schema not expanded. requires_action still unevidenced.",
    "Lilly: sextile indifferent good; square enmity and not good; trine unity/concord/friendship; opposition a bad aspect; conjunction good or ill according to the question. None of these attest requires_action.",
    "requires_action is boolean in schema (no unknown/not_evidenced). false here means the opened locus does not establish the property — not the assertion 'this aspect does not require action'. Schema not expanded.",
    "Lilly I.19 sharpens I.1: square = imperfect enmity; opposition = perfect hatred; sextile/trine = love/unity (trine stronger); conjunction good/bad as the planets are friends or enemies. Still not Ptolemy sex-harmony. Do not copy into interaction."
  ],
  "claims": [
    {
      "concept_id": "claim.aspect.trine.harmonious",
      "source_id": "src.classical.ptolemy_tetrabiblos",
      "source_class": "classical",
      "author": "Claudius Ptolemy / J.M. Ashmand trans.",
      "edition": "Ashmand 1822; Gutenberg ebook 70850",
      "school": "hellenistic",
      "reviewer": null,
      "reviewed_at": null,
      "locus": "Tetrabiblos Book I Chapter XVI (Ashmand p.24–26)",
      "original_claim": "Triangular distance of a hundred and twenty degrees is a configuration. Trine and sextile are called harmonious, being between signs of the same sex.",
      "normalized_claim": "Trine is a 120-degree configuration classed harmonious",
      "evidence_tier": "school_specific",
      "review_status": "extracted",
      "field": "interaction"
    },
    {
      "concept_id": "claim.aspect.trine.angle",
      "source_id": "src.classical.ptolemy_tetrabiblos",
      "source_class": "classical",
      "author": "Claudius Ptolemy / J.M. Ashmand trans.",
      "edition": "Ashmand 1822; Gutenberg ebook 70850",
      "school": "hellenistic",
      "reviewer": null,
      "reviewed_at": null,
      "locus": "Tetrabiblos Book I Chapter XVI (Ashmand p.24–26)",
      "original_claim": "Triangular distance of a hundred and twenty degrees is a configuration. Trine and sextile are called harmonious, being between signs of the same sex.",
      "normalized_claim": "trine is 120 degrees",
      "evidence_tier": "supported",
      "review_status": "compared",
      "field": "angle"
    },
    {
      "concept_id": "claim.aspect.trine.angle",
      "source_id": "src.classical.lilly_christian_astrology",
      "source_class": "classical",
      "author": "William Lilly",
      "edition": "Christian Astrology 1659; Wikisource p.25–26",
      "school": "traditional_horary",
      "reviewer": null,
      "reviewed_at": null,
      "locus": "Book I Chapter I Aspects (1659 p.25–26)",
      "original_claim": "When two Planets are 120 degrees distant, they are in Trine Aspect.",
      "normalized_claim": "Trine is 120 degrees",
      "evidence_tier": "supported",
      "review_status": "compared",
      "field": "angle"
    },
    {
      "concept_id": "claim.aspect.trine.lilly_quality",
      "source_id": "src.classical.lilly_christian_astrology",
      "source_class": "classical",
      "author": "William Lilly",
      "edition": "Christian Astrology 1659; Wikisource p.25–26",
      "school": "traditional_horary",
      "reviewer": null,
      "reviewed_at": null,
      "locus": "Book I Chapter I Aspects (1659 p.25–26)",
      "original_claim": "Trine denotes Unity, Concord and Friendship.",
      "normalized_claim": "Lilly classes trine as unity, concord, friendship",
      "evidence_tier": "school_specific",
      "review_status": "extracted",
      "field": "interaction"
    },
    {
      "source_id": "src.classical.lilly_christian_astrology",
      "source_class": "classical",
      "author": "William Lilly",
      "edition": "Christian Astrology 1659; Archive.org 1647/1659 text",
      "school": "traditional_horary",
      "reviewer": null,
      "reviewed_at": null,
      "concept_id": "claim.aspect.trine.lilly19_unity",
      "locus": "Book I Chapter XIX Terms and Aspects (1659 p.105)",
      "original_claim": "Sextile and trine are arguments of love, unity and friendship; the trine is more forcible.",
      "normalized_claim": "Lilly I.19: trine is unity/friendship, stronger than sextile",
      "evidence_tier": "school_specific",
      "review_status": "extracted",
      "field": "interaction"
    }
  ]
}
